{
  "$schema": "http://json-schema.org/draft-07/schema#",
  "$id": "https://workflowlookup.io/schemas/workflow/v1.0.0",
  "title": "Workflow Schema",
  "description": "Schema for defining workflows in the Workflow Orchestration System",
  "type": "object",
  "properties": {
    "id": {
      "type": "string",
      "description": "Unique identifier for the workflow",
      "pattern": "^[a-z0-9-]+$",
      "minLength": 3,
      "maxLength": 64
    },
    "name": {
      "type": "string",
      "description": "Human-friendly title of the workflow",
      "minLength": 1,
      "maxLength": 128
    },
    "description": {
      "type": "string",
      "description": "What this workflow accomplishes",
      "minLength": 1,
      "maxLength": 512
    },
    "preconditions": {
      "type": "array",
      "description": "Prerequisites that must be met before starting the workflow",
      "items": {
        "type": "string",
        "minLength": 1,
        "maxLength": 256
      },
      "uniqueItems": true
    },
    "clarificationPrompts": {
      "type": "array",
      "description": "Questions to ask upfront to resolve ambiguities",
      "items": {
        "type": "string",
        "minLength": 1,
        "maxLength": 256
      },
      "uniqueItems": true
    },
    "steps": {
      "type": "array",
      "description": "The sequence of steps in the workflow",
      "items": {
        "type": "object",
        "properties": {
          "id": {
            "type": "string",
            "description": "Unique identifier for the step",
            "pattern": "^[a-z0-9-]+$",
            "minLength": 3,
            "maxLength": 64
          },
          "title": {
            "type": "string",
            "description": "Human-friendly title of the step",
            "minLength": 1,
            "maxLength": 128
          },
          "prompt": {
            "type": "string",
            "description": "The prompt to execute for this step",
            "minLength": 1,
            "maxLength": 2048
          },
          "askForFiles": {
            "type": "boolean",
            "description": "Whether to ask for files during this step",
            "default": false
          },
          "requireConfirmation": {
            "type": "boolean",
            "description": "Whether to require user confirmation before proceeding",
            "default": false
          }
        },
        "required": [
          "id",
          "title",
          "prompt"
        ],
        "additionalProperties": false
      },
      "minItems": 1
    },
    "metaGuidance": {
      "type": "array",
      "description": "Persistent best practices that apply throughout the workflow",
      "items": {
        "type": "string",
        "minLength": 1,
        "maxLength": 256
      },
      "uniqueItems": true
    }
  },
  "required": [
    "id",
    "name",
    "description",
    "steps"
  ],
  "additionalProperties": false
}
